{
  "$schema": "http://json-schema.org/draft-07/schema#",
  "$id": "https://nirs4all.io/schemas/node.schema.json",
  "title": "NodeDefinition",
  "description": "Schema for pipeline editor node definitions",
  "type": "object",
  "required": ["id", "name", "type", "description", "parameters", "source"],
  "properties": {
    "id": {
      "type": "string",
      "pattern": "^[a-z_]+\\.[a-z_0-9]+$",
      "description": "Unique identifier in format 'type.name', e.g., 'preprocessing.snv'"
    },
    "name": {
      "type": "string",
      "minLength": 1,
      "description": "Display name for the node"
    },
    "type": {
      "$ref": "#/definitions/NodeType",
      "description": "Primary category/type of the node"
    },
    "subType": {
      "type": "string",
      "description": "Sub-type for flow/utility nodes that preserves rendering distinction (e.g. branch, merge, generator, chart, comment)"
    },
    "classPath": {
      "type": "string",
      "description": "Full Python import path, e.g., 'sklearn.preprocessing.MinMaxScaler'"
    },
    "functionPath": {
      "type": "string",
      "description": "For function-based operators, e.g., 'nirs4all.operators.models.tensorflow.nicon.customizable_nicon'"
    },
    "capabilities": {
      "$ref": "#/definitions/OperatorCapabilityDeclaration",
      "description": "Optional planning/execution capability contract for multi-backend operators."
    },
    "implementationRefs": {
      "type": "array",
      "items": { "$ref": "#/definitions/OperatorImplementationRef" },
      "description": "Optional shorthand implementation references for multi-backend operators."
    },
    "aliases": {
      "type": "array",
      "items": { "type": "string" },
      "description": "Alternative names for the node"
    },
    "description": {
      "type": "string",
      "description": "Short description for tooltips"
    },
    "longDescription": {
      "type": "string",
      "description": "Extended documentation"
    },
    "category": {
      "type": "string",
      "description": "Subcategory for palette organization"
    },
    "icon": {
      "type": "string",
      "description": "Optional icon override (Lucide icon name)"
    },
    "color": {
      "$ref": "#/definitions/ColorScheme",
      "description": "Optional color override"
    },
    "tags": {
      "type": "array",
      "items": { "type": "string" },
      "description": "Searchable tags"
    },
    "parameters": {
      "type": "array",
      "items": { "$ref": "parameter.schema.json" },
      "description": "Parameter definitions for this node"
    },
    "isAdvanced": {
      "type": "boolean",
      "default": false,
      "description": "Hide in basic mode"
    },
    "isDeepLearning": {
      "type": "boolean",
      "default": false,
      "description": "Show training config tab"
    },
    "isExperimental": {
      "type": "boolean",
      "default": false,
      "description": "Show warning badge"
    },
    "isDeprecated": {
      "type": "boolean",
      "default": false,
      "description": "Show deprecation notice"
    },
    "deprecationMessage": {
      "type": "string",
      "description": "Migration guidance for deprecated nodes"
    },
    "validAfter": {
      "type": "array",
      "items": { "$ref": "#/definitions/NodeType" },
      "description": "Can only appear after these types"
    },
    "validBefore": {
      "type": "array",
      "items": { "$ref": "#/definitions/NodeType" },
      "description": "Can only appear before these types"
    },
    "requiresSplitter": {
      "type": "boolean",
      "default": false,
      "description": "Must have a splitter before this node"
    },
    "maxInstances": {
      "type": "integer",
      "minimum": 1,
      "description": "Maximum occurrences in pipeline"
    },
    "supportsParameterSweeps": {
      "type": "boolean",
      "default": true,
      "description": "Can use _range_, _or_, etc."
    },
    "supportsFinetuning": {
      "type": "boolean",
      "default": false,
      "description": "Can use finetune_params (models only)"
    },
    "supportsStepGenerator": {
      "type": "boolean",
      "default": false,
      "description": "Can be wrapped in _or_ at step level"
    },
    "isContainer": {
      "type": "boolean",
      "default": false,
      "description": "Has children (sample_augmentation, branch, etc.)"
    },
    "containerType": {
      "type": "string",
      "enum": [
        "branches",
        "children",
        "augmentation",
        "feature_ops",
        "filters",
        "transforms",
        "source_branches",
        "list",
        "nested_list"
      ],
      "description": "How children are organized"
    },
    "defaultBranches": {
      "type": "integer",
      "minimum": 0,
      "description": "Initial branch count for container nodes"
    },
    "generatorKind": {
      "type": "string",
      "enum": ["or", "cartesian", "grid", "zip", "chain", "sample", "range", "log_range"],
      "description": "For generator nodes, the kind of generator"
    },
    "generatorType": {
      "type": "string",
      "description": "Generator subtype used by some generator definitions (e.g. or, cartesian, grid)."
    },

    "acceptsChildren": {
      "type": "boolean",
      "default": false,
      "description": "Whether this container accepts child steps in the editor."
    },
    "childTypes": {
      "type": "array",
      "items": { "$ref": "#/definitions/NodeType" },
      "description": "Allowed child node types for this container (editor hint)."
    },
    "trainOnlyContainer": {
      "type": "boolean",
      "default": false,
      "description": "Training-only container (e.g. sample augmentation / sample filter)."
    },
    "layout": {
      "type": "object",
      "description": "Optional layout hints for the editor.",
      "properties": {
        "orientation": {
          "type": "string",
          "enum": ["horizontal", "vertical"]
        },
        "label": { "type": "string" },
        "showBranchLabels": { "type": "boolean" },
        "showSourceLabels": { "type": "boolean" }
      },
      "additionalProperties": true
    },

    "executionMode": {
      "type": "string",
      "description": "Optional execution hint for UI-only nodes."
    },
    "isVisualization": {
      "type": "boolean",
      "default": false,
      "description": "Convenience flag for visualization steps."
    },
    "isComment": {
      "type": "boolean",
      "default": false,
      "description": "Convenience flag for comment steps."
    },
    "source": {
      "type": "string",
      "enum": ["nirs4all", "sklearn", "custom", "editor", "n4m"],
      "description": "Source of the node definition"
    },
    "version": {
      "type": "string",
      "description": "Minimum nirs4all version required"
    },
    "maxVersion": {
      "type": "string",
      "description": "Maximum supported version (for deprecated)"
    },
    "legacyClassPaths": {
      "type": "array",
      "items": { "type": "string" },
      "description": "Previous class paths for backwards compatibility"
    },
    "_webapp_meta": {
      "$ref": "#/definitions/WebappNodeMetadata",
      "description": "Additional webapp-only metadata for curation and audit controls."
    },
    "_webapp_split": {
      "$ref": "#/definitions/WebappSplitMetadata",
      "description": "Splitter-specific webapp metadata for runtime grouping behavior."
    }
  },
  "definitions": {
    "NodeType": {
      "type": "string",
      "enum": [
        "preprocessing",
        "y_processing",
        "splitting",
        "model",
        "augmentation",
        "filter",
        "flow",
        "utility"
      ]
    },
    "FlowSubType": {
      "type": "string",
      "enum": [
        "branch",
        "merge",
        "generator",
        "sample_augmentation",
        "feature_augmentation",
        "sample_filter",
        "concat_transform",
        "sequential"
      ]
    },
    "UtilitySubType": {
      "type": "string",
      "enum": [
        "chart",
        "comment"
      ]
    },
    "ColorScheme": {
      "type": "object",
      "properties": {
        "border": { "type": "string" },
        "bg": { "type": "string" },
        "hover": { "type": "string" },
        "selected": { "type": "string" },
        "text": { "type": "string" },
        "active": { "type": "string" },
        "gradient": { "type": "string" }
      }
    },
    "CapabilityLevel": {
      "type": "string",
      "enum": [
        "unavailable",
        "metadata",
        "plan",
        "execute_local",
        "execute_remote",
        "execute_wasm"
      ]
    },
    "OperatorImplementationRef": {
      "type": "object",
      "required": ["backend"],
      "properties": {
        "backend": {
          "type": "string",
          "description": "Implementation backend id, e.g. sklearn, n4a-methods, cluster, or wasm."
        },
        "id": {
          "type": "string",
          "description": "Backend-specific implementation id."
        },
        "label": {
          "type": "string",
          "description": "Optional user-facing implementation label."
        },
        "level": {
          "$ref": "#/definitions/CapabilityLevel",
          "description": "Highest supported capability level for this implementation."
        },
        "compute": {
          "type": "array",
          "items": { "type": "string" },
          "description": "Optional compute features, e.g. cuda, omp, blas."
        }
      },
      "additionalProperties": true
    },
    "OperatorCapabilityDeclaration": {
      "type": "object",
      "properties": {
        "defaultLevel": {
          "$ref": "#/definitions/CapabilityLevel",
          "description": "Fallback capability level when no backend report is available."
        },
        "implementationRefs": {
          "type": "array",
          "items": { "$ref": "#/definitions/OperatorImplementationRef" }
        },
        "requiredPackages": {
          "type": "array",
          "items": { "type": "string" },
          "description": "Optional package ids needed by the local implementation."
        }
      },
      "additionalProperties": true
    },
    "WebappNodeMetadata": {
      "type": "object",
      "properties": {
        "skipAudit": { "type": "boolean" },
        "skipReason": { "type": "string" }
      },
      "additionalProperties": true
    },
    "WebappSplitMetadata": {
      "type": "object",
      "required": ["groupRequired", "groupHandling"],
      "properties": {
        "groupRequired": {
          "type": "boolean",
          "description": "Whether the splitter requires an effective group."
        },
        "groupHandling": {
          "type": "string",
          "enum": ["native", "wrapper"],
          "description": "How the splitter consumes groups at runtime."
        },
        "runtimeOnlyParams": {
          "type": "array",
          "items": { "type": "string" },
          "description": "Execution-time params that must not be passed to the constructor."
        }
      },
      "additionalProperties": false
    }
  }
}
